uri,reg:identifier,rdf:type[0],skos:definition@bg[0],skos:definition@en[0],skos:definition@es[0],skos:definition@fr[0],skos:definition@it[0],skos:definition@lv[0],skos:definition@ru[0],skos:definition@sr[0],skos:definition@zh[0],skos:inScheme[0],skos:prefLabel@bg,skos:prefLabel@en,skos:prefLabel@es,skos:prefLabel@fr,skos:prefLabel@hr,skos:prefLabel@it,skos:prefLabel@lv,skos:prefLabel@ru,skos:prefLabel@sr,skos:prefLabel@zh,skos:scopeNote@bg[0],skos:scopeNote@en[0],skos:scopeNote@es[0],skos:scopeNote@fr[0],skos:scopeNote@it[0],skos:scopeNote@lv[0],skos:scopeNote@ru[0],skos:scopeNote@sr[0],skos:scopeNote@zh[0]
isbd:terms/contentform/T1001,concepts:1200,skos:Concept,"Съдържание, изразено с цифрово кодирани данни, предназначени за компютърна обработка.",Content expressed by digitally-encoded data intended to be processed by a computer.,Contenido expresado por datos codificados digitalmente para que sean procesados por un ordenador.,Contenu exprimé sous la forme de données encodées de manière numérique prévues pour être traitées par un ordinateur.,"Un contenuto espresso mediante dati codificati in forma digitale, destinati all’elaborazione via computer.","Saturs, izteikts ar digitāli kodētiem datiem, kas paredzēti
apstrādei datoros.","Содержание, выраженное посредством данных в цифровой кодировке, предназначенных для компьютерной обработки.",Sadržaj izražen digitalno kodiranim podacima predviđenim za obradu posredstvom računara.,用于计算机处理的数字编码数据表示的内容。,isbd:terms/contentform,набор от данни,dataset,"Ejemplos son los datos numéricos, datos medioambientales, etc., utilizados por las aplicaciones de software para el cálculo de promedios, correlaciones, etc., o para producir modelos, etc., pero normalmente no se muestran en su forma pura. Se excluyen las grabaciones digitales de música, la lengua, sonidos, imágenes reproducidas por ordenador y texto.",données,skup podataka,dataset,datu kopa,электронные данные,skup podataka,数据集,"Примерите включват цифрови данни, данни за околната среда и др., използвани от компютърни приложения за изчисляване на средни стойности, корелации и др. или за създаване на модели, които обаче обикновено не се представят в суров вид. Не се включват цифрови музикални записи, реч, звуци, изображения, възпроизвеждани чрез компютър и текст.","Examples include numeric data, environmental data, etc., used by applications software to calculate averages, correlations, etc., or to produce models, etc., but not normally displayed in its raw form. Excluded are digitally recorded music, language, sounds, computer-reproduced images and text.","Ejemplos son los datos numéricos, datos medioambientales, etc., utilizados por las aplicaciones de software para el cálculo de promedios, correlaciones, etc., o para producir modelos, etc., pero normalmente no se muestran en su forma pura. Se excluyen las grabaciones digitales de música, la lengua, sonidos, imágenes reproducidas por ordenador y texto.","Par exemple, des données numériques, des données environnementales, etc. utilisées par des logiciels d’application pour calculer des moyennes, des corrélations, etc. ou bien pour produire des modèles, etc., mais qui ne sont normalement pas prévues pour être affichées sous leur forme brute. En sont exclus : la musique enregistrée sous forme numérique, le langage, les sons, les images numériques  et le texte.","Gli esempi includono i dati numerici, i dati ambientali, etc., che si usano nelle applicazioni software per calcolare medie matematiche, correlazioni, etc., o per produrre modelli, etc., ma che non si visualizzano normalmente in forma grezza. Si escludono la musica registrata in forma digitale, il linguaggio, i suoni, le immagini riprodotte al computer e i testi.","Piemēri ietver skaitliskos datus, vides datus, u.c., izmantošanai programmatūrām, lai aprēķinātu vidējos rādītājus, korelāciju, utt., vai modeļu radīšanai, utt., bet parasti nav attēloti to neapstrādātajā formā. Neietver digitāli ierakstītu mūziku, valodu, skaņas, ar datoru reproducētus attēlus un tekstu.","Примеры включают числовые данные, данные о природных явлениях и т. п., используемые компьютерными программами для вычисления средних значений, взаимосвязей и т.п., или для построения моделей, и т. п., но, как правило, не предназначенные для вывода в необработанном виде. Не включают ни цифровую музыкальную звукозапись (см. музыка), ни речь (см. устная речь), ни другие звуки (см. звуки), ни воспроизводимые компьютером изображения (см. изображения), ни текстовой материал (см. текст).","Takvi primeri su numerički podaci, ekološki podaci i slično, koje koriste računarski programi za izračunavanje prosečnih vrednosti, korelacije i drugo, ili za stvaranje modela i slično, ali, po pravilu, ne i za njihovo prikazivanje u izvornom obliku. Isključuje digitalno zabeleženu muziku, jezik, zvukove, računarski reprodukovane slike i tekst.",例如数值数据、环境数据等被应用软件用来计算平均数、相关度等或者生成模型等，它们一般不以其原始形式进行显示。不包括以数字方式记录的音乐[见 音乐]、语言[见 言谈]、声音[见 声音]、计算机制作的图像[见 图像]和文字资料[见 文字资料]。
isbd:terms/contentform/T1002,concepts:1201,skos:Concept,"Съдържание, изразено чрез линия, форма, щрих и др., предназначено за визуално възприемане. Изображението може да бъде неподвижно или движещо се, двуизмерно или триизмерно.","Content expressed through line, shape, shading, etc. An image can be still or moving, in two or three dimensions.","Contenido expresado a través de líneas, formas, sombras, etc. Una imagen puede ser fija o en movimiento, en dos o tres dimensiones.","Contenu exprimé sous la forme de lignes, formes, ombrages, etc. ; une image peut être fixe ou animée, en deux ou trois dimensions.","Un contenuto espresso mediante linee, forme, ombre, etc. Un’immagine può essere fissa o in movimento, a due o a tre dimensioni.","Saturs, izteikts ar līniju, kontūru, ēnojumu, utt., paredzēts vizuālai uztverei. Attēls var būt nekustīgs vai kustīgs, divdimensiju vai trīsdimensiju.","Содержание, выраженное линией, формой, штриховкой и т.п., предназначенное для зрительного восприятия. Изображение может быть неподвижным или движущимся, двухмерным или трехмерным.","Sadržaj izražen linijom, oblikom, senčenjem i slično, namenjen vizuelnom doživljaju.",用于视觉感知的、通过线条、形状、阴影等表示的内容。图像可以是静止的或运动的，可以是二维的或三维的。,isbd:terms/contentform,изображение,image,imagen,image,slika,immagine,attēls,изображение,slika,图像,"Примерите включват художествени репродукции, карти, фотографии, изображения, получени с дистанционно измерване, стереографи, кинофилми и литографии.","Examples include art reproductions, maps, raised relief maps, photographs, remote-sensing images, stereographs, motion pictures, and lithographs.","Como ejemplos se incluyen reproducciones de arte, mapas, fotografías, imágenes de teledetección, estereográficas, películas y litografías.","Par exemple, des reproductions d’art, des cartes, des cartes en relief, des photographies, des images de télédétection, des vues stéréoscopiques, des films cinématographiques et des lithographies.","Gli esempi includono le riproduzioni d’arte, le carte geografiche, le carte geografiche in rilievo, le fotografie, le immagini di telerilevamento, gli stereogrammi, i film e le litografie.","Piemēri ietver mākslas darbu reprodukcijas, kartes, fotogrāfijas, tālizpētes attēlus, stenogrāfijas, kinofilmas un litogrāfijas.","Примеры включают репродукции произведений искусства, карты, фотографии, дистанционные сенсорные изображения, стереографии, кинофильмы и литографии.","Slika može da bude nepokretna i pokretna, dvodimenzionalna ili trodimenzionalna. Primeri za to su umetničke reprodukcije, karte, fotografije, slike dobijene daljinskom detekcijom, stereografije, filmovi i litografije.",例如艺术复制品、地图、照片、遥感影像、立体图、电影和版画。
isbd:terms/contentform/T1003,concepts:1202,skos:Concept,"Съдържание, изразено чрез движение, т.е. действие или процес на промяна на местоположението на предмет или лице.","Content expressed through motion, i.e. the act or process of changing the position of an object or person.","Contenido expresado a través del movimiento, es decir, el acto o proceso de cambio en la posición de un objeto o persona.","Contenu exprimé sous la forme de mouvement, c’est-à-dire l’action ou le processus de changer la position d’un objet ou d’une personne.","Un contenuto espresso mediante il moto, p.e. l’atto o il processo tramite il quale si cambia la posizione di un oggetto o di una persona.","Saturs, izteikts ar kustību, t.i. objekta vai personas stāvokļa izmaiņas darbību vai procesu.","Содержание, выраженное посредством движения, т.е. действия или процесса перемещения предмета или лица.","Sadržaj izražen pomoću kretanja to jest, postupak ili proces promene položaja objekta ili osobe.",通过运动（即改变物体或人的位置的动作或过程）表示的内容。,isbd:terms/contentform,движение,movement,movimiento,mouvement,pokret,movimento,kustība,движение,pokret,运动,"Примерите включват танцопис, сценични действия или хореография, но изключват движещи се изображения като кинофилми.","Examples include dance notation, stage actions, or choreography, but exclude moving images, such as motion pictures.","Como ejemplos se incluyen la notación de la danza, puesta en escena, o coreografía, pero se excluyen las imágenes en movimiento tales como películas.","Par exemple, une notation chorégraphique, des indications scéniques ou une chorégraphie. En sont exclues les images animées telles que les films cinématographiques.","Gli esempi includono la notazione della danza, l’azione scenica o la coreografia, ma escludono le immagini in movimento, come i film.","Piemēri ietver deju notāciju, inscenējumu vai horeogrāfiju, bet neietver kustīgus attēlus, tādus kā kinofilmas.","Примеры включают запись движений танца, сценических действий или хореографии, но не включают движущиеся изображения, такие как кинофильмы.","Primeri za to su beleženje igre, scenskih pokreta ili koreografije, ali ne i pokretne slike, kao što su filmovi.",例如舞谱、舞台动作、编舞，但是不包括电影等运动的图像。
isbd:terms/contentform/T1004,concepts:1203,skos:Concept,"Съдържание, изразено чрез тонове или звуци, подредени в последователност, съчетание и временни взаимовръзки, за да се получи композиция. Музиката може да бъде нотирана, изпълнявана или записана в аналогов или дигитален формат като вокални, инструментални или механични звуци с ритъм, мелодия или хармония.","Content expressed through ordered tones or sounds in succession, in combination, and in temporal relationships to produce a composition. Music can be written (notation), performed, or recorded in analogue or digital formats as vocal, instrumental, or mechanical sounds having rhythm, melody, or harmony.","Contenido expresado a través de tonos o sonidos ordenados en sucesión, en combinación y en relaciones temporales para producir una composición. La música puede ser escrita (notación), interpretada o grabada en formatos analógico o digital, como sonidos vocales, instrumentales o mecánicos con ritmo, melodía o armonía.","Contenu exprimé sous la forme de notes ordonnées ou de sons successifs, combinés entre eux ou reliés dans le temps pour produire une composition ; la musique peut être écrite (notation musicale), interprétée ou enregistrée dans des formats analogiques ou numériques sous une forme vocale, instrumentale ou sous la forme de sons mécaniques ayant rythme, mélodie ou harmonie.","Un contenuto espresso mediante toni o suoni ordinati in successione, in combinazione e in relazione temporale, in modo da produrre una composizione; la musica può essere scritta (notazione), eseguita, o registrata in forma analogica o digitale, consistendo in suoni vocali, strumentali o meccanici dotati di ritmo, melodia, o armonia.","Saturs, izteikts ar toņu vai skaņu secības palīdzību, kombinācijā un īslaicīgās attiecībās, lai radītu kompozīciju. Mūzika var tikt pierakstīta (notis), izpildīta vai ierakstīta analogā vai digitālā formātā kā balss, instrumentālas vai mehāniskas skaņas, kam piemīt ritms, melodija vai harmonija.","Содержание, выраженное посредством упорядоченных тонов и звуков в последовательности, в сочетании и во временном взаимоотношении, чтобы воспроизвести композицию. Музыка может быть записанной с помощью знаков (ноты), исполняемой либо записанной в аналоговом или цифровом форматах в виде вокальных, инструментальных или механических звуков, обладающих ритмом, мелодией или гармонией.","Sadržaj izražen pomoću kombinovanih tonova ili zvukova poređanih u određenom redosledu i u određenim vremenskim odnosima kako bi produkovali kompoziciju. Muzika može da bude pisana (notacija), izvedena ili snimljena u analognim ili digitalnim oblicima kao vokalni, instrumentalni ili mehanički zvukovi koji imaju ritam, melodiju ili harmoniju.",通过有序的音调或声音，以前后相继方式、以组合方式和以时间关系表示的内容，用以产生出一部作品。音乐可以是书写的（乐谱）、演出的、或者被记录成模拟的或数字的格式，可以是有节奏、旋律或和声的人声、乐器或者机械声音。,isbd:terms/contentform,музика,music,música,musique,glazba,musica,mūzika,музыка,muzika,音乐,"Примерите включват нотирана музика (партитури или партии) и музикални звукозаписи (концертни изпълнения, опери и студийни записи).","Examples include written music, such as scores or parts, and recorded music, such as concert performances, opera, and studio recordings.","Como ejemplos se incluyen la música escrita, como las partituras o partes y la música grabada, como los conciertos, ópera y grabaciones de estudio.","Par exemple, la musique écrite, telle que partitions ou parties et la musique enregistrée, telle que concerts, opéra et enregistrements en studio.","Gli esempi includono la musica scritta, come le partiture o le parti, e la musica registrata, come le esecuzioni in forma di concerto, l’opera, e le registrazioni in studio.","Piemēri ietver notis, kā piem., partitūras un partijas, un mūzikas ierakstus, kā piem., koncerti, operas un studiju ieraksti.","Примеры включают ноты, например, партитуры и партии, а также музыкальные звукозаписи, например, концерты, оперы и студийные записи.","Primeri za to su napisana muzika, kao što su deonice ili partiture, snimljena muzika, kao što su izvođenje koncerata, opera i studijsko snimanje.",例如总谱或分谱等书写的音乐以及音乐会演奏、歌剧和录音棚录音等录制的音乐。
isbd:terms/contentform/T1005,concepts:1204,skos:Concept,"Съдържание, изразено чрез триизмерен материал, което може да бъде както природен обект, така и създаден от човек или произведен от машина артефакт.","Content expressed through three-dimensional material, either naturally occurring entities, or human-made/machine-manufactured artefacts.","Contenido expresado a través de material tridimensional, ya sean entidades de origen natural o artefactos creados a mano o fabricados a máquina.",Contenu exprimé sous la forme d’entités naturelles ou d’artefacts fabriqués manuellement ou mécaniquement.,"Un contenuto espresso sia mediante cose e organismi naturali, sia mediante prodotti realizzati dall’uomo o dalla macchina.","Saturs, izteikts trīsdimensiju materiālā, vai nu dabiski veidotas entītijas vai cilvēka radīti/ar mašīnu apstrādāti artefakti.","Содержание, выраженное посредством трехмерного материала, как природные образования, так и сделанные человеком/ выполненные машиной артефакты.","Sadržaj izražen pomoću trodimenzionalne građe, bilo da su to prirodni entiteti ili artefakta koja je napravio čovek ili proizvela mašina.",通过三维材料（或者是自然出现的实体，或者是人造/机器制造的物品）表示的内容。,isbd:terms/contentform,предмет,object,objeto,objet,objekt,oggetto,objekts,объект,objekat,实物,"Артефакти са и триизмерни структури или реалии и включват скулптури, модели, игри, пъзели, монети, играчки, сгради, съоръжения, облекло, предмети на културата и др. Природните обекти включват изкопаеми, скали, насекоми, биологични образци на слайдове и др. Картографските обекти включват глобуси, релефни модели и напречни разрези, предназначени за гледане отстрани в триизмерен формат.","Also referred to as three-dimensional structures or realia, examples of artefacts include sculpture, models, games, jigsaw puzzles, coins, toys, buildings, equipment, clothing, cultural, and other items. Naturally occurring entities include fossils, rocks, insects, biological specimens on slides, etc. Cartographic objects include globes, relief models, and cross-sections intended to be viewed from the side in three-dimensional form, but not raised relief maps.","También conocidos como estructuras tridimensionales o realia, como ejemplos de artefactos se incluyen esculturas, modelos, juegos, rompecabezas, monedas, juguetes, edificios, equipos, ropa, objetos culturales y otros artículos. Las entidades de origen natural son, entre otras, fósiles, rocas, insectos, muestras biológicas en diapositivas, etc. Como objetos cartográficos se incluyen globos, modelos en relieve y las secciones transversales destinadas a verse de lado en forma tridimensional.","Également identifiés par des expressions telles que structures tridimensionnelles ou realia, les artefacts comprennent : sculptures, maquettes, jeux, monnaies, jouets, bâtiments, équipement, habillement, objets culturels et autres ; les objets naturels comprennent : fossiles, cailloux, insectes, spécimens biologiques sur lame, etc. ; les objets cartographiques comprennent : globes, maquettes et coupes transversales prévues pour être regardées en trois dimensions mais non les cartes en relief.","Gli esempi, che comprendono anche le strutture tridimensionali o realia, includono le sculture, i modelli, i giochi, le monete, i giocattoli, le costruzioni, le attrezzature, i capi di vestiario, i manufatti e altri articoli. Le cose e gli organismi naturali includono i fossili, le rocce, gli insetti, i campioni biologici su vetrino, etc.; gli oggetti cartografici includono i globi, i modelli in rilievo e le sezioni trasversali a vista laterale tridimensionale diverse dalle carte geografiche in rilievo.",,,,也称为为三维结构或三维实物，人工物品例如雕塑、模型、游戏、拼图、硬币、玩具、建筑、设备、衣物、文物等。自然出现的实体例如化石、岩石、昆虫、生物样品幻灯片等。地图资料实物包括三维形式的球仪、地形模型以及用于从侧面观看的横截面。
isbd:terms/contentform/T1006,concepts:1205,skos:Concept,"Съдържание, изразено чрез цифрово кодирани инструкции, предназначени за обработка и изпълнение от компютър.",Content expressed through digitally-encoded instructions intended to be processed and performed by a computer.,Contenido expresado a través de instrucciones codificadas digitalmente destinado a ser procesado e interpretado por ordenador.,Contenu exprimé sous la forme d’instructions encodées de manière numérique prévues pour être analysées et traitées par un ordinateur.,"Un contenuto espresso mediante istruzioni codificate in forma digitale, destinato all’elaborazione e all’esecuzione via computer.","Saturs, izteikts ar digitāli kodētām instrukcijām, kas paredzēts apstrādei un izpildei ar datoru. ","Содержание, выраженное посредством инструкций в цифровой кодировке, предназначенных для обработки и выполнения компьютером.",Sadržaj izražen pomoću digitalno kodiranih instrukcija namenjenih za računarsku obradu i prikaz.,通过用于计算机处理或执行的数字编码指令所表示的内容。,isbd:terms/contentform,програма,program,"Como ejemplos se incluyen sistemas operativos, aplicaciones de software, etc.",programme,program,programma,programma,программа,program,程序,"Примерите включват операционни системи, приложен софтуер и др.","Examples include operating systems, application software, etc.","Como ejemplos se incluyen sistemas operativos, aplicaciones de software, etc. ","Par exemple, des systèmes d’exploitation, des logiciels d’application, etc.","Gli esempi includono i sistemi operativi, le applicazioni software, etc.","Piemēri ietver operētājsistēmas, lietojumprogrammatūras, utt.","Примеры включают операционные системы, прикладное программное обеспечение и т.п.","Primeri za to su operativni sistemi, aplikativni programi i tako dalje.",例如操作系统、应用软件等。
