uri,reg:identifier,rdf:type[0],skos:definition@bg[0],skos:definition@en[0],skos:definition@es[0],skos:definition@fr[0],skos:definition@it[0],skos:definition@lv[0],skos:definition@ru[0],skos:definition@sr[0],skos:definition@zh[0],skos:inScheme[0],skos:prefLabel@bg,skos:prefLabel@en,skos:prefLabel@es,skos:prefLabel@fr,skos:prefLabel@hr,skos:prefLabel@it,skos:prefLabel@lv,skos:prefLabel@ru,skos:prefLabel@sr,skos:prefLabel@zh,skos:scopeNote@bg[0],skos:scopeNote@en[0],skos:scopeNote@es[0],skos:scopeNote@fr[0],skos:scopeNote@it[0],skos:scopeNote@lv[0],skos:scopeNote@ru[0],skos:scopeNote@sr[0],skos:scopeNote@zh[0]
isbd:terms/contentform/T1007,concepts:1206,skos:Concept,"Съдържание, изразено чрез звуци, произведени от животни, птици, естествени източници на шум или подобни звуци, уподобявани от човешки глас или от дигитално (или аналогово) средство.","Content expressed through sounds made by animals, birds, naturally occurring sources of noise, or such sounds simulated by the human voice or digital (or analogue) media.","Contenido expresado a través de sonidos de animales, aves, ruidos de origen natural, o sonidos simulados por la voz humana o medio digital (o analógico).","Contenu exprimé sous la forme de sons émis par des animaux, des oiseaux, des sources sonores naturelles ou la simulation de ces sons produite par la voix humaine ou un média numérique (ou analogique).","Un contenuto espresso mediante suoni prodotti da animali, uccelli, fonti sonore naturali, oppure mediante suoni simulati dalla voce umana o da strumenti digitali (o analogici).","Saturs, izteikts ar skaņu starpniecību, ko rada dzīvnieki, putni, dabiski skaņu avoti vai tamlīdzīgas skaņas, ko rada cilvēks ar balsi vai ar digitāliem (vai analogiem) medijiem/datnešiem.","Содержание, выраженное посредством звуков, производимых животными, птицами, природными источниками звуков, или подобные звуки, воспроизводимые человеческим голосом или электронными (либо аналоговыми) средствами.","Sadržaj izražen zvukovima koje proizvode životinje, ptice, drugi izvori zvuka u prirodi ili takvim zvukovima koji se oponašaju ljudskim glasom ili digitalnim (ili analognim) medijem.",通过动物、鸟、自然出现的噪声源或者由人声或数字（或模拟）媒体模仿的此类声音表示的内容。,isbd:terms/contentform,звуци,sounds,sonidos,son,zvukovi,suoni,skaņas,эвуки,zvukovi,声音,"Примерите включват записи на птичи песни, животински звуци и звукови ефекти, но не включват музикални звукозаписи и записи на човешка реч.","Examples include recordings of bird songs, animal calls, and sound effects, but exclude recorded music, and recorded human speech.","Como ejemplos se incluyen grabaciones de cantos de aves, reclamos de animales y efectos de sonido, pero se excluye la música grabada y grabaciones de voz humana.","Par exemple, des enregistrements de chants d’oiseaux, des cris d’animaux et des effets sonores à l’exception des enregistrements de musique et des enregistrements de discours humain.","Gli esempi includono le registrazioni del canto degli uccelli, i richiami degli animali e gli effetti sonori, ma escludono la musica registrata e il linguaggio umano registrato.","Piemēri ietver putnu dziesmu ierakstus, dzīvnieku kliedzienus un trokšņu efektus, bet neietver ierakstītu mūziku un ierakstītu cilvēka runu.","Примеры включают записи песен птиц, криков животных, шумовых эффектов, но не включают ни записанную музыку, ни записанную человеческую речь.","Takvi primeri su snimak pesme ptica, životinjski zov i zvučni efekti, ali ne i muzički snimci i govor ljudi.",例如鸟鸣、动物嚎叫的录音和声音效果，但是不包括录制的音乐和录制的人类讲话。
isbd:terms/contentform/T1008,concepts:1207,skos:Concept,"Съдържание, изразено чрез звука от гласа на говорещ човек.",Content expressed through the sound of the human voice talking.,Contenido expresado a través del sonido de la voz humana al hablar.,Contenu exprimé sous la forme de mots prononcés par une voix humaine.,Un contenuto espresso mediante il suono della voce umana che parla.,"Saturs, izteikts ar runājoša cilvēka balss skaņu.","Содержание, выраженное посредством звука голоса говорящего человека.",Sadržaj izražen ljudskim govorom.,通过人声谈话的声音表示出来的内容。,isbd:terms/contentform,говор,spoken word,palabra hablada,parole énoncée,izgovorena riječ,parlato,mutvārdi,устная речь,živa reč,言谈,"Примерите включват говорещи книги, радиопредавания, звукозаписи на устна история, звукозаписи на пиеси, записани както в аналогов, така и в дигитален формат.","Examples include talking books, radio broadcasts, oral history recordings, and audio recordings of plays, whether recorded in analogue or digital format.","Como ejemplos se incluyen libros hablados, emisiones de radio, grabaciones de historia oral y grabaciones de audio de obras, ya sean grabaciones en formato analógico o digital.
","Par exemple, livres parlés, émissions radiophoniques, enregistrements de récits oraux et enregistrements sonores de pièces de théâtre, que l’enregistrement soit analogique ou numérique.","Gli esempi includono i libri parlanti, le trasmissioni radiofoniche, le registrazioni di racconti orali e le registrazioni audio di opere teatrali, sia in forma analogica che in forma digitale.","Piemēri ietver klausāmgrāmatas, radioraidījumus, mutvārdu vēstures ierakstus, lugu audio ierakstus, kas ierakstīti digitālā vai analogā formātā.","Примеры включают звуковые книги, радиопередачи, звукозаписи устных рассказов, аудиозаписи пьес, записанных как в аналоговом, так и в цифровом формате.","Takvi primeri su čitanje knjiga, radio emitovanje, snimljena usmena istorija i audio snimci pozorišnih komada, u analognom ili digitalnom obliku.",例如有声图书、无线电广播、口述历史录音、戏剧的录音，不管是用模拟格式还是用数字格式录音的。
isbd:terms/contentform/T1009,concepts:1208,skos:Concept,"Съдържание, изразено чрез записани думи, символи и цифри.","Content expressed through written words, symbols and numbers.","Contenido expresado a través de palabras, símbolos y números escritos.","Contenu exprimé sous la forme de mots écrits, de symboles et de chiffres.","Un contenuto espresso mediante parole, simboli e numeri scritti.","Saturs, izteikts ar pierakstītiem vārdiem, simboliem un
cipariem.","Содержание, выраженное посредством записанных слов, символов или чисел.",,通过书写单词、符号和数字表示的内容。,isbd:terms/contentform,текст,text,texto,texte,tekst,testo,teksts,текст,,文字资料,"Примерите включват книги (печатни и електронни), кореспонденция, бази данни на списания и микрофилмирани вестници.","Examples include books (printed or electronic), correspondence, databases of journals, and microfilmed newspapers.","Como ejemplos se incluyen libros (impresos o electrónicos), correspondencia, bases de datos de revistas y periódicos microfilmados.","Par exemple, livres (imprimés ou électroniques), correspondances, bases de données de revues et journaux microfilmés.","Gli esempi includono i libri (a stampa oppure elettronici), le corrispondenze, i database di periodici scientifici e i giornali in microfilm.","Piemēri ietver grāmatas (iespiestās vai elektroniskās), saraksti, žurnālu datubāzes un mikrofilmētus laikrakstus.","Примеры включают книги (печатные и электронные), переписку, базы данных журналов и микрофильмированные газеты.",,例如图书（印刷的或电子的）、书信、期刊数据库、缩微复制的报纸等。
isbd:terms/contentform/T1010,concepts:1209,skos:Concept,"Смесено съдържание, към което са приложими три или повече форми.",Mixed content where three or more forms are applicable.,Contenido mixto en el que se aplican tres o más formas.,Contenu mixte auquel s’appliquent au moins trois formes du contenu.,Un contenuto misto al quale si applicano tre o più forme.,"Jaukts saturs, kurā lietojamas trīs vai vairākas formas.","Смешанное содержание, когда применимы три или более терминов формы.","Kombinovani sadržaj koga mogu da čine
tri ili više oblika.",在三种或更多种形式适用时的混合内容。,isbd:terms/contentform,различни форми на съдържанието,multiple content forms,múltiples formas del contenido,multimédia,viševrsni oblici sadržaja,forme di contenuto multiple,salikta satura formas,разные формы содержания,viševrsni oblik,多内容形式,,,,,,,,,
isbd:terms/contentform/T1011,concepts:1210,skos:Concept,,"Content expressed in a form other than dataset, image, movement, music, object, program, sounds, spoken word, or text, or in multiple content forms.","Contenido expresado en una forma diferente a la de conjunto de datos, imagen, movimiento, música, objeto, programa, sonidos, palabra hablada, texto o múltiples formas del contenido.","Contenu exprimé sous une forme autre que : données, image, mouvement, musique, objet, programme, son, parole énoncée, texte ou multimédia.","Contenuto espresso mediante una  forma diversa da dataset, immagine, movimento, musica, oggetto, programma, suoni, parlato, testo, o  da forme di contenuto multiple.",,,,,isbd:terms/contentform,друга форма на съдържанието,other content form,otra forma del contenido,forme du contenu non définie,drugi oblik sadržaja,altra forma di contenuto,satura cita forma,другая форма содержания,drugi oblik sadržaja,其他内容形式,,,,,,,,,
